doc_id,context
policy_1,Customers can request a full refund within 14 days of purchase. Refunds are processed in 5 business days.
policy_2,Two-factor authentication is mandatory for admin users. Password reset links expire after 30 minutes.
policy_3,Standard delivery takes 3 to 5 business days. International delivery can take up to 12 business days.
policy_4,Critical incidents are acknowledged within 30 minutes and resolved within 4 hours under enterprise SLA.
policy_5,Enterprise contracts include a dedicated account manager and quarterly architecture reviews.
policy_6,Invoices are issued on the first day of each month and payable within 15 calendar days.
policy_7,API credentials rotate automatically every 90 days for regulated accounts.
policy_8,Data exports are available in CSV and Parquet formats through the admin portal.
